recipient_key	recipient_name	ticker	basis	evidence	confirmed_at
5630d744-6d7b-3bff-9a76-fe728ed0174d-C	LOCKHEED MARTIN CORPORATION	LMT	own-name	Recipient name 'LOCKHEED MARTIN CORPORATION' matches SEC issuer 'LOCKHEED MARTIN CORP' (LMT)	2026-07-18
56c8509b-9988-e84a-17fe-52cbe407282f-C	MITCHELL REPAIR INFORMATION CO LLC	SNA	parent-name	SAM.gov parent 'SNAP-ON INCORPORATED' matches SEC issuer 'Snap-on Inc' (SNA); subsidiary 'MITCHELL REPAIR INFORMATION CO LLC' per SAM.gov hierarchy	2026-07-18
58465eb6-2fbe-cf76-0826-be3fa0af837b-C	SIKORSKY SUPPORT SERVICES INC	RTX	parent-name	SAM.gov parent 'RTX CORP' matches SEC issuer 'RTX Corp' (RTX); subsidiary 'SIKORSKY SUPPORT SERVICES INC' per SAM.gov hierarchy	2026-07-18
5ad7895c-192b-21cd-8baf-92c6dce0b593-C	LOCKHEED MARTIN CORPORATION	LMT	own-name	Recipient name 'LOCKHEED MARTIN CORPORATION' matches SEC issuer 'LOCKHEED MARTIN CORP' (LMT)	2026-07-18
5b3db994-356c-dd09-c567-c688e10ac628-C	GOODRICH CORPORATION	RTX	parent-name	SAM.gov parent 'RTX CORP' matches SEC issuer 'RTX Corp' (RTX); subsidiary 'GOODRICH CORPORATION' per SAM.gov hierarchy	2026-07-18
5d3f395a-6b3c-bba7-ee28-21685a44fed4-C	RLJ III - EM WEST PALM BEACH LESSEE, LLC	RLJ	parent-name	SAM.gov parent 'RLJ LODGING TRUST' matches SEC issuer 'RLJ Lodging Trust' (RLJ); subsidiary 'RLJ III - EM WEST PALM BEACH LESSEE, LLC' per SAM.gov hierarchy	2026-07-18
5daa87a2-241b-06ff-9438-17a3957c57cd-C	LOCKHEED MARTIN GLOBAL, INC.	LMT	parent-name	SAM.gov parent 'LOCKHEED MARTIN CORP' matches SEC issuer 'LOCKHEED MARTIN CORP' (LMT); subsidiary 'LOCKHEED MARTIN GLOBAL, INC.' per SAM.gov hierarchy	2026-07-18
5e095ef9-a461-36e2-8a63-2c89a2f13900-C	SYSCO CORP	SYY	own-name	Recipient name 'SYSCO CORP' matches SEC issuer 'SYSCO CORP' (SYY)	2026-07-18
5e62d7b1-b71e-8283-8703-1391e3c4d6a0-C	UNITED PARCEL SERVICE, INC.	UPS	own-name	Recipient name 'UNITED PARCEL SERVICE, INC.' matches SEC issuer 'UNITED PARCEL SERVICE INC' (UPS)	2026-07-18
5e6a1f1c-4805-89b3-1dd7-4f7d61a9e8e2-C	CANON U.S.A., INC.	CAJPY	parent-name	SAM.gov parent 'CANON INC.' matches SEC issuer 'CANON INC' (CAJPY); subsidiary 'CANON U.S.A., INC.' per SAM.gov hierarchy	2026-07-18
5efd1069-d7f9-0bc5-33e7-ab8fcbbe9cf9-C	SYNOPSYS, INC.	SNPS	own-name	Recipient name 'SYNOPSYS, INC.' matches SEC issuer 'SYNOPSYS INC' (SNPS)	2026-07-18
62c486be-b101-ea2f-e0c1-4f3bf00a305b-C	HONEYWELL INTERNATIONAL INC.	HON	own-name	Recipient name 'HONEYWELL INTERNATIONAL INC.' matches SEC issuer 'HONEYWELL INTERNATIONAL INC' (HON)	2026-07-18
645df5f2-66e3-8d2b-a612-3bff6ed3da30-C	AMAZON WEB SERVICES, INC.	AMZN	parent-name	SAM.gov parent 'AMAZON.COM, INC.' matches SEC issuer 'AMAZON COM INC' (AMZN); subsidiary 'AMAZON WEB SERVICES, INC.' per SAM.gov hierarchy	2026-07-18
681621e2-199c-1489-ce07-823b2d82bf16-C	GOODRICH CORPORATION	RTX	parent-name	SAM.gov parent 'RTX CORP' matches SEC issuer 'RTX Corp' (RTX); subsidiary 'GOODRICH CORPORATION' per SAM.gov hierarchy	2026-07-18
69204f07-d0a2-c645-1397-00236971fd4d-C	INTERNATIONAL BUSINESS MACHINES CORPORATION	IBM	own-name	Recipient name 'INTERNATIONAL BUSINESS MACHINES CORPORATION' matches SEC issuer 'INTERNATIONAL BUSINESS MACHINES CORP' (IBM)	2026-07-18
6920a0c2-36ca-bd03-b598-32666c18626a-C	SPRINT COMMUNICATIONS CO LP	TMUS	parent-name	SAM.gov parent 'T-MOBILE US, INC.' matches SEC issuer 'T-Mobile US, Inc.' (TMUS); subsidiary 'SPRINT COMMUNICATIONS CO LP' per SAM.gov hierarchy	2026-07-18
6cf5fb1b-4988-d087-5dc1-70939d8fc6c4-C	LOCKHEED MARTIN CORPORATION	LMT	own-name	Recipient name 'LOCKHEED MARTIN CORPORATION' matches SEC issuer 'LOCKHEED MARTIN CORP' (LMT)	2026-07-18
6d4d60f0-b0bb-dc2c-4a48-e9d65476777d-C	JACK HENRY & ASSOCIATES, INC.	JKHY	own-name	Recipient name 'JACK HENRY & ASSOCIATES, INC.' matches SEC issuer 'JACK HENRY & ASSOCIATES INC' (JKHY)	2026-07-18
6e7a895c-aa57-8600-2a8a-4e237f6213f6-C	LOCKHEED MARTIN CORP	LMT	own-name	Recipient name 'LOCKHEED MARTIN CORP' matches SEC issuer 'LOCKHEED MARTIN CORP' (LMT)	2026-07-18
6eda3ee1-f612-3b12-8ada-a920384dd80b-C	JOHNSON CONTROLS GOVERNMENT SYSTEMS, LLC	JCI	parent-name	SAM.gov parent 'JOHNSON CONTROLS, INC.' matches SEC issuer 'Johnson Controls International plc' (JCI); subsidiary 'JOHNSON CONTROLS GOVERNMENT SYSTEMS, LLC' per SAM.gov hierarchy	2026-07-18
6f092509-207f-6c70-3116-f871ddf4fde6-C	SIRCHIE ACQUISITION CO LLC	RJF	parent-name	SAM.gov parent 'RAYMOND JAMES FINANCIAL  INC.' matches SEC issuer 'RAYMOND JAMES FINANCIAL INC' (RJF); subsidiary 'SIRCHIE ACQUISITION CO LLC' per SAM.gov hierarchy	2026-07-18
6f82dd8b-4c28-12ab-8d02-6e7f207dad8b-C	BRANTNER AND ASSOCIATES, INC.	TEL	parent-name	SAM.gov parent 'TE CONNECTIVITY LTD.' matches SEC issuer 'TE Connectivity plc' (TEL); subsidiary 'BRANTNER AND ASSOCIATES, INC.' per SAM.gov hierarchy	2026-07-18
6ffc4386-853e-ef89-67e8-22c28ddcf15c-C	INTERNATIONAL BUSINESS MACHINES CORPORATION	IBM	own-name	Recipient name 'INTERNATIONAL BUSINESS MACHINES CORPORATION' matches SEC issuer 'INTERNATIONAL BUSINESS MACHINES CORP' (IBM)	2026-07-18
707d6ba0-1a69-315e-5c43-ed322b2029ed-C	YOUNG & RUBICAM LLC	WPP	parent-name	SAM.gov parent 'WPP PLC' matches SEC issuer 'WPP plc' (WPP); subsidiary 'YOUNG & RUBICAM LLC' per SAM.gov hierarchy	2026-07-18
71a58244-ee49-c0e8-764f-0103af941762-C	MILLERKNOLL INC	MLKN	own-name	Recipient name 'MILLERKNOLL INC' matches SEC issuer 'MILLERKNOLL, INC.' (MLKN)	2026-07-18
71b54b3f-92e0-d636-616b-6bff5be7d76e-C	NUVASIVE CLINICAL SERVICES MONITORING, INC.	GMED	parent-name	SAM.gov parent 'GLOBUS MEDICAL, INC.' matches SEC issuer 'GLOBUS MEDICAL INC' (GMED); subsidiary 'NUVASIVE CLINICAL SERVICES MONITORING, INC.' per SAM.gov hierarchy	2026-07-18
72559450-0f09-e12b-024d-743eeeffb054-C	HONEYWELL INTERNATIONAL INC.	HON	own-name	Recipient name 'HONEYWELL INTERNATIONAL INC.' matches SEC issuer 'HONEYWELL INTERNATIONAL INC' (HON)	2026-07-18
7261cb38-689d-0370-e6db-897eb1e5aa32-C	AURIS HEALTH, INC	JNJ	parent-name	SAM.gov parent 'JOHNSON & JOHNSON' matches SEC issuer 'JOHNSON & JOHNSON' (JNJ); subsidiary 'AURIS HEALTH, INC' per SAM.gov hierarchy	2026-07-18
72827cbd-31d1-c872-d5b4-0c9b25253f7d-C	SNAP-ON TOOLS INTERNATIONAL, LLC	SNA	parent-name	SAM.gov parent 'SNAP-ON INCORPORATED' matches SEC issuer 'Snap-on Inc' (SNA); subsidiary 'SNAP-ON TOOLS INTERNATIONAL, LLC' per SAM.gov hierarchy	2026-07-18
72cdcd20-1c98-67b4-b744-6c119c53377a-C	FLOWERS BAKING CO OF DENTON, LLC	FLO	parent-name	SAM.gov parent 'FLOWERS FOODS INC' matches SEC issuer 'FLOWERS FOODS INC' (FLO); subsidiary 'FLOWERS BAKING CO OF DENTON, LLC' per SAM.gov hierarchy	2026-07-18
73e4ede0-fada-8100-d103-da8154e69dd3-C	B9 SELECT RESI VA OWNER LLC	RHP	parent-name	SAM.gov parent 'RYMAN HOSPITALITY PROPERTIES, INC.' matches SEC issuer 'Ryman Hospitality Properties, Inc.' (RHP); subsidiary 'B9 SELECT RESI VA OWNER LLC' per SAM.gov hierarchy	2026-07-18
769befe2-3919-53e9-5f0f-430397a863b0-C	SOUTHWEST GAS CORPORATION	SWX	own-name	Recipient name 'SOUTHWEST GAS CORPORATION' matches SEC issuer 'Southwest Gas Holdings, Inc.' (SWX)	2026-07-18
7743786a-287f-b18c-2bc2-3bdc23e728a4-C	HEALTHEQUITY, INC.	HQY	own-name	Recipient name 'HEALTHEQUITY, INC.' matches SEC issuer 'HEALTHEQUITY, INC.' (HQY)	2026-07-18
779b3e3e-364f-7cbc-28a4-a2b4484b86f4-C	LOCKHEED MARTIN CORPORATION	LMT	own-name	Recipient name 'LOCKHEED MARTIN CORPORATION' matches SEC issuer 'LOCKHEED MARTIN CORP' (LMT)	2026-07-18
77ac8374-ea6a-12e4-de3d-54719e3a0bcf-C	HONEYWELL INTERNATIONAL INC	HON	own-name	Recipient name 'HONEYWELL INTERNATIONAL INC' matches SEC issuer 'HONEYWELL INTERNATIONAL INC' (HON)	2026-07-18
784eb51b-b1af-f697-80e4-06385f31b860-C	CEB INC.	IT	parent-name	SAM.gov parent 'GARTNER, INC.' matches SEC issuer 'GARTNER INC' (IT); subsidiary 'CEB INC.' per SAM.gov hierarchy	2026-07-18
785f8c2a-77bb-b4db-c19a-08d6d86d19a6-C	HONEYWELL INTERNATIONAL INC.	HON	own-name	Recipient name 'HONEYWELL INTERNATIONAL INC.' matches SEC issuer 'HONEYWELL INTERNATIONAL INC' (HON)	2026-07-18
7a954f30-eada-36b9-2b45-2db412908b7a-C	SIKORSKY AIRCRAFT CORPORATION	RTX	parent-name	SAM.gov parent 'RTX CORP' matches SEC issuer 'RTX Corp' (RTX); subsidiary 'SIKORSKY AIRCRAFT CORPORATION' per SAM.gov hierarchy	2026-07-18
7d1eac33-f87a-7f1c-3029-054d8e5684b5-C	CLOUDFLARE, INC.	NET	own-name	Recipient name 'CLOUDFLARE, INC.' matches SEC issuer 'Cloudflare, Inc.' (NET)	2026-07-18
7fa3419d-995b-54ec-dfec-78f878e0b59e-C	FACTSET RESEARCH SYSTEMS INC.	FDS	own-name	Recipient name 'FACTSET RESEARCH SYSTEMS INC.' matches SEC issuer 'FACTSET RESEARCH SYSTEMS INC' (FDS)	2026-07-18
800b0df9-146e-cc59-ed59-d0bc4caf9664-C	CANON U.S.A., INC.	CAJPY	parent-name	SAM.gov parent 'CANON INC.' matches SEC issuer 'CANON INC' (CAJPY); subsidiary 'CANON U.S.A., INC.' per SAM.gov hierarchy	2026-07-18
80d7942d-de44-b391-8c3b-ecd05b5dbe53-C	GENERAL DYNAMICS MISSION SYSTEMS, INC.	GD	parent-name	SAM.gov parent 'GENERAL DYNAMICS CORP' matches SEC issuer 'GENERAL DYNAMICS CORP' (GD); subsidiary 'GENERAL DYNAMICS MISSION SYSTEMS, INC.' per SAM.gov hierarchy	2026-07-18
819a698f-debc-805d-90bf-b64413f35fdc-C	CANON MEDICAL SYSTEMS USA, INC	CAJPY	parent-name	SAM.gov parent 'CANON INC.' matches SEC issuer 'CANON INC' (CAJPY); subsidiary 'CANON MEDICAL SYSTEMS USA, INC' per SAM.gov hierarchy	2026-07-18
827c3318-8db6-971f-be93-aa9ec4468d03-C	RTX BBN TECHNOLOGIES, INC.	RTX	parent-name	SAM.gov parent 'RTX CORP' matches SEC issuer 'RTX Corp' (RTX); subsidiary 'RTX BBN TECHNOLOGIES, INC.' per SAM.gov hierarchy	2026-07-18
8331bcf2-039d-6e60-51ec-f9df98c68887-C	GENERAL DYNAMICS INFORMATION TECHNOLOGY, INC.	GD	parent-name	SAM.gov parent 'GENERAL DYNAMICS CORP' matches SEC issuer 'GENERAL DYNAMICS CORP' (GD); subsidiary 'GENERAL DYNAMICS INFORMATION TECHNOLOGY, INC.' per SAM.gov hierarchy	2026-07-18
84655a23-e9d4-3888-de97-8d9f8550c9f2-C	ENCORE MEDICAL, L.P.	BX	parent-name	SAM.gov parent 'BLACKSTONE INC.' matches SEC issuer 'Blackstone Inc.' (BX); subsidiary 'ENCORE MEDICAL, L.P.' per SAM.gov hierarchy	2026-07-18
878a2f09-eee2-eacc-bb11-94e1af5dd653-C	JOHNSON CONTROLS INC	JCI	own-name	Recipient name 'JOHNSON CONTROLS INC' matches SEC issuer 'Johnson Controls International plc' (JCI)	2026-07-18
88199f05-5712-54a6-7917-601ddc851cc4-C	JOHNSON CONTROLS BUILDING AUTOMATION SYSTEMS, LLC	JCI	parent-name	SAM.gov parent 'JOHNSON CONTROLS, INC.' matches SEC issuer 'Johnson Controls International plc' (JCI); subsidiary 'JOHNSON CONTROLS BUILDING AUTOMATION SYSTEMS, LLC' per SAM.gov hierarchy	2026-07-18
895ae7a7-a463-07eb-91e9-7f9ad1b958da-C	FELCOR UNION SQUARE LESSEE, LLC	RLJ	parent-name	SAM.gov parent 'RLJ LODGING TRUST' matches SEC issuer 'RLJ Lodging Trust' (RLJ); subsidiary 'FELCOR UNION SQUARE LESSEE, LLC' per SAM.gov hierarchy	2026-07-18
8a26c273-aa5b-a586-2c99-20a1b5710129-C	AT&T CORP.	T	own-name	Recipient name 'AT&T CORP.' matches SEC issuer 'AT&T INC.' (T)	2026-07-18
8a580323-b93b-d883-9ee2-312490d8c03a-C	WASTE MANAGEMENT OF PENNSYLVANIA, INC.	WM	parent-name	SAM.gov parent 'WASTE MANAGEMENT, INC.' matches SEC issuer 'WASTE MANAGEMENT INC' (WM); subsidiary 'WASTE MANAGEMENT OF PENNSYLVANIA, INC.' per SAM.gov hierarchy	2026-07-18
8cac1796-b994-6d54-94d4-00cd00e4a075-C	ABBOTT RAPID DX NORTH AMERICA LLC	ABT	parent-name	SAM.gov parent 'ABBOTT LABORATORIES' matches SEC issuer 'ABBOTT LABORATORIES' (ABT); subsidiary 'ABBOTT RAPID DX NORTH AMERICA LLC' per SAM.gov hierarchy	2026-07-18
8ccdac14-ed77-83af-da40-58f2073e887e-C	PERSONNEL DECISIONS RESEARCH INSTITUTES, LLC	IT	parent-name	SAM.gov parent 'GARTNER, INC.' matches SEC issuer 'GARTNER INC' (IT); subsidiary 'PERSONNEL DECISIONS RESEARCH INSTITUTES, LLC' per SAM.gov hierarchy	2026-07-18
8e28d0b8-5297-7835-1f69-8fce707daf27-C	INTUITIVE SURGICAL INC	ISRG	own-name	Recipient name 'INTUITIVE SURGICAL INC' matches SEC issuer 'INTUITIVE SURGICAL INC' (ISRG)	2026-07-18
8e3a2ef5-3697-f6f3-5f35-a4c008071d6b-C	GLOBUS MEDICAL, INC.	GMED	own-name	Recipient name 'GLOBUS MEDICAL, INC.' matches SEC issuer 'GLOBUS MEDICAL INC' (GMED)	2026-07-18
8ff89796-7e33-ce57-e468-ec4d4448b866-C	RSA SECURITY LLC	DELL	parent-name	SAM.gov parent 'DELL TECHNOLOGIES INC.' matches SEC issuer 'Dell Technologies Inc.' (DELL); subsidiary 'RSA SECURITY LLC' per SAM.gov hierarchy	2026-07-18
90e456fc-97f0-9098-9e66-36975f0f3770-C	L. L. ROWE COMPANY	TEL	parent-name	SAM.gov parent 'TE CONNECTIVITY LTD.' matches SEC issuer 'TE Connectivity plc' (TEL); subsidiary 'L. L. ROWE COMPANY' per SAM.gov hierarchy	2026-07-18
91b0761f-a2de-b7fd-1e40-b8988212371d-C	MARRIOTT INTERNATIONAL, INC.	RHP	parent-name	SAM.gov parent 'RYMAN HOSPITALITY PROPERTIES, INC.' matches SEC issuer 'Ryman Hospitality Properties, Inc.' (RHP); subsidiary 'MARRIOTT INTERNATIONAL, INC.' per SAM.gov hierarchy	2026-07-18
925ebbdb-01c8-326b-4110-acb8fd5a7414-C	MEARS GROUP INC	PWR	parent-name	SAM.gov parent 'QUANTA SERVICES, INC.' matches SEC issuer 'QUANTA SERVICES, INC.' (PWR); subsidiary 'MEARS GROUP INC' per SAM.gov hierarchy	2026-07-18
92758004-9797-9b84-aca3-932d2c0322e5-C	COINBASE INC	COIN	parent-name	SAM.gov parent 'COINBASE GLOBAL  INC' matches SEC issuer 'Coinbase Global, Inc.' (COIN); subsidiary 'COINBASE INC' per SAM.gov hierarchy	2026-07-18
928e25a1-e379-d2e2-3294-32c9d3159947-C	CARRIER ENTERPRISE, LLC	WSO	parent-name	SAM.gov parent 'WATSCO, INC.' matches SEC issuer 'WATSCO INC' (WSO); subsidiary 'CARRIER ENTERPRISE, LLC' per SAM.gov hierarchy	2026-07-18
93fb1b1c-53e8-fc01-bcb6-b6a7af1273b1-C	BOOZ ALLEN HAMILTON ENGINEERING SERVICES, LLC	BAH	parent-name	SAM.gov parent 'BOOZ ALLEN HAMILTON HOLDING CORPORATION' matches SEC issuer 'Booz Allen Hamilton Holding Corp' (BAH); subsidiary 'BOOZ ALLEN HAMILTON ENGINEERING SERVICES, LLC' per SAM.gov hierarchy	2026-07-18
9499aa66-87aa-0f1a-10f0-a581034359c9-C	GRIMES AEROSPACE COMPANY	HON	parent-name	SAM.gov parent 'HONEYWELL INTERNATIONAL INC.' matches SEC issuer 'HONEYWELL INTERNATIONAL INC' (HON); subsidiary 'GRIMES AEROSPACE COMPANY' per SAM.gov hierarchy	2026-07-18
953b6e49-f189-0070-008e-9abed09925ac-C	HONEYWELL AEROSPACE YEOVIL	HON	parent-name	SAM.gov parent 'HONEYWELL INTERNATIONAL INC.' matches SEC issuer 'HONEYWELL INTERNATIONAL INC' (HON); subsidiary 'HONEYWELL AEROSPACE YEOVIL' per SAM.gov hierarchy	2026-07-18
9598a33d-4e64-adda-a1b0-34603409a4cd-C	ACCLARENT, INC	JNJ	parent-name	SAM.gov parent 'JOHNSON & JOHNSON' matches SEC issuer 'JOHNSON & JOHNSON' (JNJ); subsidiary 'ACCLARENT, INC' per SAM.gov hierarchy	2026-07-18
963017a4-7c44-8029-c07b-ea24185fdc8a-C	BLACKROCK FINANCIAL MANAGEMENT INC	BLK	parent-name	SAM.gov parent 'BLACKROCK, INC.' matches SEC issuer 'BlackRock, Inc.' (BLK); subsidiary 'BLACKROCK FINANCIAL MANAGEMENT INC' per SAM.gov hierarchy	2026-07-18
9657d2d6-ea0a-6d43-d3d2-56f93a9384af-C	HONEYWELL INTERNATIONAL INC.	HON	own-name	Recipient name 'HONEYWELL INTERNATIONAL INC.' matches SEC issuer 'HONEYWELL INTERNATIONAL INC' (HON)	2026-07-18
96c5fa29-f046-fa3e-3112-e548ee6a526f-C	SOLAR TURBINES INCORPORATED	CAT	parent-name	SAM.gov parent 'CATERPILLAR INC.' matches SEC issuer 'CATERPILLAR INC' (CAT); subsidiary 'SOLAR TURBINES INCORPORATED' per SAM.gov hierarchy	2026-07-18
98183ce7-7fa7-ff61-3b5e-060fc0a294e2-C	FISHER SCIENTIFIC COMPANY L.L.C.	TMO	parent-name	SAM.gov parent 'THERMO FISHER SCIENTIFIC INC.' matches SEC issuer 'THERMO FISHER SCIENTIFIC INC.' (TMO); subsidiary 'FISHER SCIENTIFIC COMPANY L.L.C.' per SAM.gov hierarchy	2026-07-18
99ca957e-94d5-66a2-9d4a-8ff0601e794d-C	AVAGO TECHNOLOGIES US INC	AVGO	parent-name	SAM.gov parent 'BROADCOM INC.' matches SEC issuer 'Broadcom Inc.' (AVGO); subsidiary 'AVAGO TECHNOLOGIES US INC' per SAM.gov hierarchy	2026-07-18
9b96a5e8-7aa6-15db-84f2-0c3878e4aaba-C	CITIBANK, N.A.	C	parent-name	SAM.gov parent 'CITIGROUP INC.' matches SEC issuer 'CITIGROUP INC' (C); subsidiary 'CITIBANK, N.A.' per SAM.gov hierarchy	2026-07-18
9bca02d6-dc64-52ba-4d3e-bc5b38b1f6a5-C	CATERPILLAR INC	CAT	own-name	Recipient name 'CATERPILLAR INC' matches SEC issuer 'CATERPILLAR INC' (CAT)	2026-07-18
9c282e38-d785-86bf-6733-2065159b2919-C	JOHNSON CONTROLS, INC	JCI	own-name	Recipient name 'JOHNSON CONTROLS, INC' matches SEC issuer 'Johnson Controls International plc' (JCI)	2026-07-18
9ca06d06-287d-7bc5-0748-b773d09f12eb-C	T-MOBILE USA, INC.	TMUS	own-name	Recipient name 'T-MOBILE USA, INC.' matches SEC issuer 'T-Mobile US, Inc.' (TMUS)	2026-07-18
9dc269de-4b2d-9035-9d39-749ff3661031-C	GEIGER INTERNATIONAL INC	MLKN	parent-name	SAM.gov parent 'MILLERKNOLL INC' matches SEC issuer 'MILLERKNOLL, INC.' (MLKN); subsidiary 'GEIGER INTERNATIONAL INC' per SAM.gov hierarchy	2026-07-18
9e483c5d-7352-28b3-89dd-33052a121331-C	CUMMINS POWER GENERATION INC.	CMI	parent-name	SAM.gov parent 'CUMMINS INC.' matches SEC issuer 'CUMMINS INC' (CMI); subsidiary 'CUMMINS POWER GENERATION INC.' per SAM.gov hierarchy	2026-07-18
9ef0f53f-0e5b-4a26-6aed-27fc8e2f4788-C	CAREDX, INC.	CDNA	own-name	Recipient name 'CAREDX, INC.' matches SEC issuer 'CareDx, Inc.' (CDNA)	2026-07-18
a033f445-de74-654e-59d9-ea1a2f61fb73-C	MSCI INC	MSCI	own-name	Recipient name 'MSCI INC' matches SEC issuer 'MSCI Inc.' (MSCI)	2026-07-18
a0ef059e-42bf-0e69-637c-270e7f0fe556-C	SAP NATIONAL SECURITY SERVICES INC	SAP	parent-name	SAM.gov parent 'SAP SE' matches SEC issuer 'SAP SE' (SAP); subsidiary 'SAP NATIONAL SECURITY SERVICES INC' per SAM.gov hierarchy	2026-07-18
a1ed8c29-7fb0-6b9f-864b-ea1c77e08891-C	HOST HOTELS & RESORTS LP	HST	own-name	Recipient name 'HOST HOTELS & RESORTS LP' matches SEC issuer 'HOST HOTELS & RESORTS, INC.' (HST)	2026-07-18
a2854240-44c7-519b-4914-020b2317a659-C	ALERE SAN DIEGO, INC.	ABT	parent-name	SAM.gov parent 'ABBOTT LABORATORIES' matches SEC issuer 'ABBOTT LABORATORIES' (ABT); subsidiary 'ALERE SAN DIEGO, INC.' per SAM.gov hierarchy	2026-07-18
a32ad0b3-979f-4fbe-900f-5d0232368bbd-C	EQUIFAX INFORMATION SERVICES LLC	EFX	parent-name	SAM.gov parent 'EQUIFAX INC' matches SEC issuer 'EQUIFAX INC' (EFX); subsidiary 'EQUIFAX INFORMATION SERVICES LLC' per SAM.gov hierarchy	2026-07-18
a3374bb6-88f5-88cf-3bdb-b4c6d825fd98-C	LOCKHEED MARTIN CORP	LMT	own-name	Recipient name 'LOCKHEED MARTIN CORP' matches SEC issuer 'LOCKHEED MARTIN CORP' (LMT)	2026-07-18
a3d96349-e421-0c3b-e82c-c8b235732d69-C	KEYSIGHT TECHNOLOGIES, INC.	KEYS	own-name	Recipient name 'KEYSIGHT TECHNOLOGIES, INC.' matches SEC issuer 'Keysight Technologies, Inc.' (KEYS)	2026-07-18
a4aa9eb2-0b4e-544d-d1c3-a838749a60ed-C	CLARIS INTERNATIONAL INC.	AAPL	parent-name	SAM.gov parent 'APPLE INC.' matches SEC issuer 'Apple Inc.' (AAPL); subsidiary 'CLARIS INTERNATIONAL INC.' per SAM.gov hierarchy	2026-07-18
a4c28996-484c-cf28-76b4-8e46e982c93e-C	ROCKWELL COLLINS, INC.	RTX	parent-name	SAM.gov parent 'RTX CORP' matches SEC issuer 'RTX Corp' (RTX); subsidiary 'ROCKWELL COLLINS, INC.' per SAM.gov hierarchy	2026-07-18
a62fa63a-9b78-b4be-b33d-eb009a40a77c-C	PUBLIC SERVICE COMPANY OF COLORADO	XEL	parent-name	SAM.gov parent 'XCEL ENERGY INC.' matches SEC issuer 'XCEL ENERGY INC' (XEL); subsidiary 'PUBLIC SERVICE COMPANY OF COLORADO' per SAM.gov hierarchy	2026-07-18
a6504795-f2b9-5f80-a0b8-c1cb5899212e-C	BLACKROCK INSTITUTIONAL TRUST COMPANY NATIONAL ASSOCIATION	BLK	parent-name	SAM.gov parent 'BLACKROCK, INC.' matches SEC issuer 'BlackRock, Inc.' (BLK); subsidiary 'BLACKROCK INSTITUTIONAL TRUST COMPANY NATIONAL ASSOCIATION' per SAM.gov hierarchy	2026-07-18
a756c2b0-8906-ba0d-e0bb-cca92a88ee2f-C	HP INC.	HPQ	own-name	Recipient name 'HP INC.' matches SEC issuer 'HP INC' (HPQ)	2026-07-18
a81c9133-71d7-9646-43d5-eb0e55cd73cc-C	BIO-RAD LABORATORIES, INC.	BIO	own-name	Recipient name 'BIO-RAD LABORATORIES, INC.' matches SEC issuer 'BIO-RAD LABORATORIES, INC.' (BIO)	2026-07-18
a8e3de84-2045-6b38-2f7d-1470d3efdc95-C	MICROGENICS CORPORATION	TMO	parent-name	SAM.gov parent 'THERMO FISHER SCIENTIFIC INC.' matches SEC issuer 'THERMO FISHER SCIENTIFIC INC.' (TMO); subsidiary 'MICROGENICS CORPORATION' per SAM.gov hierarchy	2026-07-18
a8e90c7c-8175-41a5-b841-5b038f67a07d-C	UNITED PARCEL SERVICE CO.	UPS	own-name	Recipient name 'UNITED PARCEL SERVICE CO.' matches SEC issuer 'UNITED PARCEL SERVICE INC' (UPS)	2026-07-18
ab05ceb2-d750-3470-0575-3ffe0d9cc616-C	HONEYWELL INTERNATIONAL INC	HON	own-name	Recipient name 'HONEYWELL INTERNATIONAL INC' matches SEC issuer 'HONEYWELL INTERNATIONAL INC' (HON)	2026-07-18
abe97812-085d-1dad-04d8-0e90d2ca0f1a-C	CAREMARK RX, L.L.C.	CVS	parent-name	SAM.gov parent 'CVS HEALTH CORPORATION' matches SEC issuer 'CVS HEALTH Corp' (CVS); subsidiary 'CAREMARK RX, L.L.C.' per SAM.gov hierarchy	2026-07-18
ac0b9590-0ad8-0854-a7ed-8474dc0b203b-C	RAYTHEON COMPANY	RTX	parent-name	SAM.gov parent 'RTX CORP' matches SEC issuer 'RTX Corp' (RTX); subsidiary 'RAYTHEON COMPANY' per SAM.gov hierarchy	2026-07-18
ad35c12e-7105-a0e3-d98a-5918beef4c6a-C	KEYSIGHT TECHNOLOGIES INC	KEYS	own-name	Recipient name 'KEYSIGHT TECHNOLOGIES INC' matches SEC issuer 'Keysight Technologies, Inc.' (KEYS)	2026-07-18
afd3aa9a-cbaa-9be4-1ddb-7b2690601c48-C	VERACYTE, INC.	VCYT	own-name	Recipient name 'VERACYTE, INC.' matches SEC issuer 'VERACYTE, INC.' (VCYT)	2026-07-18
afdcb1d9-116b-6676-344c-3c7deb8ecf76-C	MEDICAL SPECIALTIES INC	HCA	parent-name	SAM.gov parent 'HCA HEALTHCARE, INC.' matches SEC issuer 'HCA Healthcare, Inc.' (HCA); subsidiary 'MEDICAL SPECIALTIES INC' per SAM.gov hierarchy	2026-07-18
b08f8773-1e62-248a-d212-05bf5257410e-C	LEXISNEXIS RISK SOLUTIONS INC	RELX	parent-name	SAM.gov parent 'RELX PLC' matches SEC issuer 'RELX PLC' (RELX); subsidiary 'LEXISNEXIS RISK SOLUTIONS INC' per SAM.gov hierarchy	2026-07-18
b20b122a-596c-14ad-0033-6e5bc41f4768-C	RAYTHEON COMPANY	RTX	parent-name	SAM.gov parent 'RTX CORP' matches SEC issuer 'RTX Corp' (RTX); subsidiary 'RAYTHEON COMPANY' per SAM.gov hierarchy	2026-07-18
b2d89a5f-9cb0-1d9e-ced9-0d379873ccf1-C	GENERAL DYNAMICS MISSION SYSTEMS, INC.	GD	parent-name	SAM.gov parent 'GENERAL DYNAMICS CORP' matches SEC issuer 'GENERAL DYNAMICS CORP' (GD); subsidiary 'GENERAL DYNAMICS MISSION SYSTEMS, INC.' per SAM.gov hierarchy	2026-07-18
b4b8c717-7458-45ff-103c-4a7453207027-C	ROCKWELL AUTOMATION, INC.	ROK	own-name	Recipient name 'ROCKWELL AUTOMATION, INC.' matches SEC issuer 'ROCKWELL AUTOMATION, INC' (ROK)	2026-07-18
b51a086e-6081-49cc-6565-c7341fdfd56e-C	SEATTLE UNION STREET ASSOCIATES	RHP	parent-name	SAM.gov parent 'RYMAN HOSPITALITY PROPERTIES, INC.' matches SEC issuer 'Ryman Hospitality Properties, Inc.' (RHP); subsidiary 'SEATTLE UNION STREET ASSOCIATES' per SAM.gov hierarchy	2026-07-18
b5efc906-dc09-c632-df80-da2973e64153-C	MOTOROLA SOLUTIONS, INC.	MSI	own-name	Recipient name 'MOTOROLA SOLUTIONS, INC.' matches SEC issuer 'Motorola Solutions, Inc.' (MSI)	2026-07-18
b638e162-f732-50b3-c5b9-9fe1086d041a-C	GALLATIN RIVER COMMUNICATIONS, L.L.C.	LUMN	parent-name	SAM.gov parent 'LUMEN TECHNOLOGIES, INC' matches SEC issuer 'Lumen Technologies, Inc.' (LUMN); subsidiary 'GALLATIN RIVER COMMUNICATIONS, L.L.C.' per SAM.gov hierarchy	2026-07-18
b6b091bb-570b-bf26-3e7a-b4a1a7c2d61a-C	RAYTHEON COMPANY	RTX	parent-name	SAM.gov parent 'RTX CORP' matches SEC issuer 'RTX Corp' (RTX); subsidiary 'RAYTHEON COMPANY' per SAM.gov hierarchy	2026-07-18
b706783c-a759-4f66-8953-20fda4bd1acc-C	THERMO EBERLINE LLC	TMO	parent-name	SAM.gov parent 'THERMO FISHER SCIENTIFIC INC.' matches SEC issuer 'THERMO FISHER SCIENTIFIC INC.' (TMO); subsidiary 'THERMO EBERLINE LLC' per SAM.gov hierarchy	2026-07-18
b8a507ef-0ba0-e553-27ac-c0d5823b7bd2-C	IAN EVAN & ALEXANDER CORP	BAH	parent-name	SAM.gov parent 'BOOZ ALLEN HAMILTON HOLDING CORPORATION' matches SEC issuer 'Booz Allen Hamilton Holding Corp' (BAH); subsidiary 'IAN EVAN & ALEXANDER CORP' per SAM.gov hierarchy	2026-07-18
b91e6418-aa27-f6c2-90a9-1545753a6d15-C	RAYTHEON COMPANY	RTX	parent-name	SAM.gov parent 'RTX CORP' matches SEC issuer 'RTX Corp' (RTX); subsidiary 'RAYTHEON COMPANY' per SAM.gov hierarchy	2026-07-18
b97d19b0-833c-8d8f-3a2c-157d04ea55ef-C	LOCKHEED MARTIN CORP	LMT	own-name	Recipient name 'LOCKHEED MARTIN CORP' matches SEC issuer 'LOCKHEED MARTIN CORP' (LMT)	2026-07-18
ba54128b-d307-1a1b-8efb-7fd3c35ec697-C	INCENTIVE TECHNOLOGY GROUP LLC	ICFI	parent-name	SAM.gov parent 'ICF INTERNATIONAL, INC.' matches SEC issuer 'ICF International, Inc.' (ICFI); subsidiary 'INCENTIVE TECHNOLOGY GROUP LLC' per SAM.gov hierarchy	2026-07-18
ba61d3e5-9ee2-62c6-7002-6eb9efd7682d-C	RAYTHEON COMPANY	RTX	parent-name	SAM.gov parent 'RTX CORP' matches SEC issuer 'RTX Corp' (RTX); subsidiary 'RAYTHEON COMPANY' per SAM.gov hierarchy	2026-07-18
bb5b6359-96c9-5534-938c-4e768bdf7d2e-C	NORESCO, LLC	RTX	parent-name	SAM.gov parent 'RTX CORP' matches SEC issuer 'RTX Corp' (RTX); subsidiary 'NORESCO, LLC' per SAM.gov hierarchy	2026-07-18
bb71d7cd-d3e5-e496-6896-4d4005925f76-C	GENERAL DYNAMICS INFORMATION TECHNOLOGY, INC.	GD	parent-name	SAM.gov parent 'GENERAL DYNAMICS CORP' matches SEC issuer 'GENERAL DYNAMICS CORP' (GD); subsidiary 'GENERAL DYNAMICS INFORMATION TECHNOLOGY, INC.' per SAM.gov hierarchy	2026-07-18
bba3f7fd-f185-9f3b-8985-e8ea6bd3253e-C	S&P GLOBAL MARKET INTELLIGENCE LLC	SPGI	parent-name	SAM.gov parent 'S&P GLOBAL INC.' matches SEC issuer 'S&P Global Inc.' (SPGI); subsidiary 'S&P GLOBAL MARKET INTELLIGENCE LLC' per SAM.gov hierarchy	2026-07-18
bbf342a7-6485-cb2f-432f-751ea2506efc-C	STARLIMS CORPORATION	ABT	parent-name	SAM.gov parent 'ABBOTT LABORATORIES' matches SEC issuer 'ABBOTT LABORATORIES' (ABT); subsidiary 'STARLIMS CORPORATION' per SAM.gov hierarchy	2026-07-18
bcc6d6fc-0fa8-aac1-2016-427adf3da83f-C	BIOMARK LLC	MRK	parent-name	SAM.gov parent 'MERCK & CO., INC.' matches SEC issuer 'Merck & Co., Inc.' (MRK); subsidiary 'BIOMARK LLC' per SAM.gov hierarchy	2026-07-18
bd24e068-bcad-bd3f-24c2-233dee816bd1-C	CUMMINS INC.	CMI	own-name	Recipient name 'CUMMINS INC.' matches SEC issuer 'CUMMINS INC' (CMI)	2026-07-18
be01076d-a1f9-6fed-33a7-be78e0546da3-C	JOHNSON CONTROLS, INC.	JCI	own-name	Recipient name 'JOHNSON CONTROLS, INC.' matches SEC issuer 'Johnson Controls International plc' (JCI)	2026-07-18
bf49f582-79fa-4760-a1cd-930e9bd9fc96-C	EQUIFAX WORKFORCE SOLUTIONS LLC	EFX	parent-name	SAM.gov parent 'EQUIFAX INC' matches SEC issuer 'EQUIFAX INC' (EFX); subsidiary 'EQUIFAX WORKFORCE SOLUTIONS LLC' per SAM.gov hierarchy	2026-07-18
