recipient_key	recipient_name	ticker	basis	evidence	confirmed_at
00f1b918-21b6-2a89-638d-0ca8b8cbd8f1-C	CUBESMART, L.P.	CUBE	parent-name	SAM.gov parent 'CUBESMART' matches SEC issuer 'CubeSmart' (CUBE); subsidiary 'CUBESMART, L.P.' per SAM.gov hierarchy	2026-07-18
01c4a3a3-b4c5-ce4e-822b-d17f09985001-C	RAYTHEON COMPANY	RTX	parent-name	SAM.gov parent 'RTX CORP' matches SEC issuer 'RTX Corp' (RTX); subsidiary 'RAYTHEON COMPANY' per SAM.gov hierarchy	2026-07-18
01e7329f-0955-7b92-eb6f-88d4f6a39ada-C	JACKSON LABS TECHNOLOGIES, INC.	VIAV	parent-name	SAM.gov parent 'VIAVI SOLUTIONS INC.' matches SEC issuer 'VIAVI SOLUTIONS INC.' (VIAV); subsidiary 'JACKSON LABS TECHNOLOGIES, INC.' per SAM.gov hierarchy	2026-07-18
02040694-f28f-e872-8789-e1bb6b24943b-C	BHR OPERATIONS, L.L.C.	RLJ	parent-name	SAM.gov parent 'RLJ LODGING TRUST' matches SEC issuer 'RLJ Lodging Trust' (RLJ); subsidiary 'BHR OPERATIONS, L.L.C.' per SAM.gov hierarchy	2026-07-18
0209b395-0044-6c01-c916-785d5e530cfd-C	ABBOTT RAPID DIAGNOSTICS INFORMATICS, INC	ABT	parent-name	SAM.gov parent 'ABBOTT LABORATORIES' matches SEC issuer 'ABBOTT LABORATORIES' (ABT); subsidiary 'ABBOTT RAPID DIAGNOSTICS INFORMATICS, INC' per SAM.gov hierarchy	2026-07-18
02d96557-827b-7983-b39e-007f84487932-C	W.W. GRAINGER, INC.	GWW	own-name	Recipient name 'W.W. GRAINGER, INC.' matches SEC issuer 'W.W. GRAINGER, INC.' (GWW)	2026-07-18
0341544e-23d8-fe98-3d76-1cdbc8b37e2f-C	VERIZON BUSINESS NETWORK SERVICES LLC	VZ	parent-name	SAM.gov parent 'VERIZON COMMUNICATIONS INC' matches SEC issuer 'VERIZON COMMUNICATIONS INC' (VZ); subsidiary 'VERIZON BUSINESS NETWORK SERVICES LLC' per SAM.gov hierarchy	2026-07-18
03e6aa2c-3b20-ee29-304a-c31f21ebb697-C	DEPUY SYNTHES SALES INC	JNJ	parent-name	SAM.gov parent 'JOHNSON & JOHNSON' matches SEC issuer 'JOHNSON & JOHNSON' (JNJ); subsidiary 'DEPUY SYNTHES SALES INC' per SAM.gov hierarchy	2026-07-18
048f7d74-e612-9fae-4a35-d74f6084ac66-C	VIRGINIA ELECTRIC AND POWER COMPANY	D	parent-name	SAM.gov parent 'DOMINION ENERGY, INC.' matches SEC issuer 'DOMINION ENERGY, INC' (D); subsidiary 'VIRGINIA ELECTRIC AND POWER COMPANY' per SAM.gov hierarchy	2026-07-18
053dbdd8-4559-4d19-68e0-1eeef06359eb-C	TWILIO INC.	TWLO	own-name	Recipient name 'TWILIO INC.' matches SEC issuer 'TWILIO INC' (TWLO)	2026-07-18
0572af7f-c8f7-6604-db66-ea4e2f1b0464-C	BOSTON SCIENTIFIC CORP	BSX	own-name	Recipient name 'BOSTON SCIENTIFIC CORP' matches SEC issuer 'BOSTON SCIENTIFIC CORP' (BSX)	2026-07-18
062de2a2-7a1a-3952-0572-54e705c0f1e0-C	SBA TOWERS IV LLC	SBAC	parent-name	SAM.gov parent 'SBA COMMUNICATIONS CORPORATION' matches SEC issuer 'SBA COMMUNICATIONS CORP' (SBAC); subsidiary 'SBA TOWERS IV LLC' per SAM.gov hierarchy	2026-07-18
063ae0c7-0487-a45d-7113-69746115d7df-C	BRUINS LESSEE LLC	PEB	parent-name	SAM.gov parent 'PEBBLEBROOK HOTEL TRUST' matches SEC issuer 'Pebblebrook Hotel Trust' (PEB); subsidiary 'BRUINS LESSEE LLC' per SAM.gov hierarchy	2026-07-18
06d55b8d-0bcb-c654-8213-1001f38dd3d2-C	AMAZON.COM SERVICES LLC	AMZN	own-name	Recipient name 'AMAZON.COM SERVICES LLC' matches SEC issuer 'AMAZON COM INC' (AMZN)	2026-07-18
07aac610-edb4-a86c-7ce4-8aebfcc17d72-C	CHARLES RIVER LABORATORIES, INC.	CRL	own-name	Recipient name 'CHARLES RIVER LABORATORIES, INC.' matches SEC issuer 'CHARLES RIVER LABORATORIES INTERNATIONAL, INC.' (CRL)	2026-07-18
07c2f679-0c96-de89-c0d0-dc2e1bba1605-C	DEPUY SYNTHES SALES, INC.	JNJ	parent-name	SAM.gov parent 'JOHNSON & JOHNSON' matches SEC issuer 'JOHNSON & JOHNSON' (JNJ); subsidiary 'DEPUY SYNTHES SALES, INC.' per SAM.gov hierarchy	2026-07-18
07cec1ba-5444-1dd1-fc10-8a488f8d8170-C	AMO SALES AND SERVICE, INC.	ABT	parent-name	SAM.gov parent 'ABBOTT LABORATORIES' matches SEC issuer 'ABBOTT LABORATORIES' (ABT); subsidiary 'AMO SALES AND SERVICE, INC.' per SAM.gov hierarchy	2026-07-18
090aeb19-5945-b597-a4c4-a3360aee2145-C	CENTERPOINT ENERGY RESOURCES CORP.	CNP	parent-name	SAM.gov parent 'CENTERPOINT ENERGY, INC.' matches SEC issuer 'CENTERPOINT ENERGY INC' (CNP); subsidiary 'CENTERPOINT ENERGY RESOURCES CORP.' per SAM.gov hierarchy	2026-07-18
098d3c62-6cd7-dfa5-b947-763fbdc54ed4-C	IRON MOUNTAIN SECURE SHREDDING, INC.	IRM	parent-name	SAM.gov parent 'IRON MOUNTAIN INCORPORATED' matches SEC issuer 'IRON MOUNTAIN INC' (IRM); subsidiary 'IRON MOUNTAIN SECURE SHREDDING, INC.' per SAM.gov hierarchy	2026-07-18
09c94e6e-003f-7a9a-a6a9-2305eb5b6025-C	APPLE INC	AAPL	own-name	Recipient name 'APPLE INC' matches SEC issuer 'Apple Inc.' (AAPL)	2026-07-18
0a1870fe-63cf-230c-7cff-41a3c552489b-C	AT&T ENTERPRISES, LLC	T	own-name	Recipient name 'AT&T ENTERPRISES, LLC' matches SEC issuer 'AT&T INC.' (T)	2026-07-18
0a4b86ce-1724-5067-6aa7-f0a9af50c129-C	ALLEGIANT AIR LLC	ALGT	parent-name	SAM.gov parent 'ALLEGIANT TRAVEL COMPANY' matches SEC issuer 'Allegiant Travel CO' (ALGT); subsidiary 'ALLEGIANT AIR LLC' per SAM.gov hierarchy	2026-07-18
0a66ad45-abfc-7ae0-0665-32d88ff1fb22-C	NORTHERN STATES POWER COMPANY	XEL	parent-name	SAM.gov parent 'XCEL ENERGY INC.' matches SEC issuer 'XCEL ENERGY INC' (XEL); subsidiary 'NORTHERN STATES POWER COMPANY' per SAM.gov hierarchy	2026-07-18
0b19e4e4-bf1e-773b-a5c6-59683d308e14-C	RIVERSIDE ENGINEERING LLC	BAH	parent-name	SAM.gov parent 'BOOZ ALLEN HAMILTON HOLDING CORPORATION' matches SEC issuer 'Booz Allen Hamilton Holding Corp' (BAH); subsidiary 'RIVERSIDE ENGINEERING LLC' per SAM.gov hierarchy	2026-07-18
0c2ec31a-524a-3983-8a91-f1b84e521dcb-C	CONSOLIDATED EDISON COMPANY OF NEW YORK, INC.	ED	parent-name	SAM.gov parent 'CONSOLIDATED EDISON, INC.' matches SEC issuer 'CONSOLIDATED EDISON INC' (ED); subsidiary 'CONSOLIDATED EDISON COMPANY OF NEW YORK, INC.' per SAM.gov hierarchy	2026-07-18
0d87bad0-744d-064c-e353-5ade09f3bc25-C	SNAP, INC	SNAP	own-name	Recipient name 'SNAP, INC' matches SEC issuer 'Snap Inc' (SNAP)	2026-07-18
0ec2982e-1af5-7c07-1267-43ca6833f333-C	MOTOROLA SOLUTIONS, INC.	MSI	own-name	Recipient name 'MOTOROLA SOLUTIONS, INC.' matches SEC issuer 'Motorola Solutions, Inc.' (MSI)	2026-07-18
0eedf238-8a2b-ad43-3239-d399ca132f85-C	HONEYWELL INTERNATIONAL, INC	HON	own-name	Recipient name 'HONEYWELL INTERNATIONAL, INC' matches SEC issuer 'HONEYWELL INTERNATIONAL INC' (HON)	2026-07-18
0f4fc69f-90b0-3adc-8052-aaef04b55efa-C	CARRIER CORPORATION	RTX	parent-name	SAM.gov parent 'RTX CORP' matches SEC issuer 'RTX Corp' (RTX); subsidiary 'CARRIER CORPORATION' per SAM.gov hierarchy	2026-07-18
108b454d-a668-8157-acbc-d6947e8e52dc-C	MCI COMMUNICATIONS SERVICES LLC	VZ	parent-name	SAM.gov parent 'VERIZON COMMUNICATIONS INC' matches SEC issuer 'VERIZON COMMUNICATIONS INC' (VZ); subsidiary 'MCI COMMUNICATIONS SERVICES LLC' per SAM.gov hierarchy	2026-07-18
13118f61-1859-be73-03d7-603420277bb2-C	S&P GLOBAL INC.	SPGI	own-name	Recipient name 'S&P GLOBAL INC.' matches SEC issuer 'S&P Global Inc.' (SPGI)	2026-07-18
14c92d76-9870-ace3-dbf2-431863daf0bd-C	KBR WYLE SERVICES, LLC	HON	parent-name	SAM.gov parent 'HONEYWELL INTERNATIONAL INC' matches SEC issuer 'HONEYWELL INTERNATIONAL INC' (HON); subsidiary 'KBR WYLE SERVICES, LLC' per SAM.gov hierarchy	2026-07-18
14e4d073-7ea5-fc77-e8ca-5b8ec1645798-C	CONCUR TECHNOLOGIES, INC.	SAP	parent-name	SAM.gov parent 'SAP SE' matches SEC issuer 'SAP SE' (SAP); subsidiary 'CONCUR TECHNOLOGIES, INC.' per SAM.gov hierarchy	2026-07-18
15b365af-a0c6-6012-a948-a35741cd0ea2-C	HONEYWELL INTERNATIONAL INC.	HON	own-name	Recipient name 'HONEYWELL INTERNATIONAL INC.' matches SEC issuer 'HONEYWELL INTERNATIONAL INC' (HON)	2026-07-18
1673f61b-6d1c-da56-666d-efb569d6b968-C	THERMO FISHER SCIENTIFIC (ASHEVILLE) LLC	TMO	parent-name	SAM.gov parent 'THERMO FISHER SCIENTIFIC INC.' matches SEC issuer 'THERMO FISHER SCIENTIFIC INC.' (TMO); subsidiary 'THERMO FISHER SCIENTIFIC (ASHEVILLE) LLC' per SAM.gov hierarchy	2026-07-18
168dba4a-3269-cddb-6256-d010ad1944d7-C	THERMO ELECTRON NORTH AMERICA LLC	TMO	parent-name	SAM.gov parent 'THERMO FISHER SCIENTIFIC INC.' matches SEC issuer 'THERMO FISHER SCIENTIFIC INC.' (TMO); subsidiary 'THERMO ELECTRON NORTH AMERICA LLC' per SAM.gov hierarchy	2026-07-18
17062da9-ec5b-68dc-3368-31e2e4478238-C	SAP PUBLIC SERVICES INC	SAP	parent-name	SAM.gov parent 'SAP SE' matches SEC issuer 'SAP SE' (SAP); subsidiary 'SAP PUBLIC SERVICES INC' per SAM.gov hierarchy	2026-07-18
17296d12-dcf2-41f7-d285-c595591b6a77-C	RAYTHEON COMPANY	RTX	parent-name	SAM.gov parent 'RTX CORP' matches SEC issuer 'RTX Corp' (RTX); subsidiary 'RAYTHEON COMPANY' per SAM.gov hierarchy	2026-07-18
18263529-f8f1-59ff-6263-cec7193e5975-C	GRIMES AEROSPACE COMPANY	HON	parent-name	SAM.gov parent 'HONEYWELL INTERNATIONAL INC' matches SEC issuer 'HONEYWELL INTERNATIONAL INC' (HON); subsidiary 'GRIMES AEROSPACE COMPANY' per SAM.gov hierarchy	2026-07-18
1a73c826-93ea-5350-f541-533cae0f38f2-C	PPG INDUSTRIES, INC.	PPG	own-name	Recipient name 'PPG INDUSTRIES, INC.' matches SEC issuer 'PPG INDUSTRIES INC' (PPG)	2026-07-18
1aa2628c-1397-0a64-42fc-579340cc3882-C	SCOTT TECHNOLOGIES, INC.	JCI	parent-name	SAM.gov parent 'JOHNSON CONTROLS, INC.' matches SEC issuer 'Johnson Controls International plc' (JCI); subsidiary 'SCOTT TECHNOLOGIES, INC.' per SAM.gov hierarchy	2026-07-18
1b23e97c-d19e-eb84-942e-5941369c9141-C	GENERAL DYNAMICS ONE SOURCE LLC	GD	parent-name	SAM.gov parent 'GENERAL DYNAMICS CORP' matches SEC issuer 'GENERAL DYNAMICS CORP' (GD); subsidiary 'GENERAL DYNAMICS ONE SOURCE LLC' per SAM.gov hierarchy	2026-07-18
1b7f3eb3-de98-faf4-9509-c4a9568ad372-C	CITIBANK, NATIONAL ASSOCIATION	C	parent-name	SAM.gov parent 'CITIGROUP INC.' matches SEC issuer 'CITIGROUP INC' (C); subsidiary 'CITIBANK, NATIONAL ASSOCIATION' per SAM.gov hierarchy	2026-07-18
1b870f9e-28fd-fecf-a5bd-abb4bd04e550-C	LOCKHEED MARTIN CORPORATION	LMT	own-name	Recipient name 'LOCKHEED MARTIN CORPORATION' matches SEC issuer 'LOCKHEED MARTIN CORP' (LMT)	2026-07-18
1c5c053c-719d-0c13-5434-9736426147ef-C	HONEYWELL INTERNATIONAL INC.	HON	own-name	Recipient name 'HONEYWELL INTERNATIONAL INC.' matches SEC issuer 'HONEYWELL INTERNATIONAL INC' (HON)	2026-07-18
1d10c8dc-bddb-c540-f234-91dd249f452e-C	ADVANCED MICRO DEVICES, INC.	AMD	own-name	Recipient name 'ADVANCED MICRO DEVICES, INC.' matches SEC issuer 'ADVANCED MICRO DEVICES INC' (AMD)	2026-07-18
1d88632b-81d6-b72b-652f-c183b3bf0481-C	GENERAL DYNAMICS MISSION SYSTEMS, INC.	GD	parent-name	SAM.gov parent 'GENERAL DYNAMICS CORP' matches SEC issuer 'GENERAL DYNAMICS CORP' (GD); subsidiary 'GENERAL DYNAMICS MISSION SYSTEMS, INC.' per SAM.gov hierarchy	2026-07-18
1e2a2523-5616-b8b9-20ad-976519364d40-C	ATMOS ENERGY CORPORATION	ATO	own-name	Recipient name 'ATMOS ENERGY CORPORATION' matches SEC issuer 'ATMOS ENERGY CORP' (ATO)	2026-07-18
1fa8e8a8-9489-3b06-779d-7bd4ce531b2e-C	AT&T CORP.	T	own-name	Recipient name 'AT&T CORP.' matches SEC issuer 'AT&T INC.' (T)	2026-07-18
1fd9c5d7-99f5-9f2b-29ce-2333453eb637-C	RAYTHEON COMPANY	RTX	parent-name	SAM.gov parent 'RTX CORP' matches SEC issuer 'RTX Corp' (RTX); subsidiary 'RAYTHEON COMPANY' per SAM.gov hierarchy	2026-07-18
1ff1ee01-c907-4842-d443-a2ba2302dcf5-C	SYSCO WESTERN MINNESOTA, INC.	SYY	parent-name	SAM.gov parent 'SYSCO CORP' matches SEC issuer 'SYSCO CORP' (SYY); subsidiary 'SYSCO WESTERN MINNESOTA, INC.' per SAM.gov hierarchy	2026-07-18
203430f8-c340-6b28-6176-a3251ad63357-C	WICKR LLC	AMZN	parent-name	SAM.gov parent 'AMAZON.COM, INC.' matches SEC issuer 'AMAZON COM INC' (AMZN); subsidiary 'WICKR LLC' per SAM.gov hierarchy	2026-07-18
2059c143-eab8-8123-0622-9f40d0741839-C	PACIFIC BELL TELEPHONE COMPANY	T	parent-name	SAM.gov parent 'AT&T INC.' matches SEC issuer 'AT&T INC.' (T); subsidiary 'PACIFIC BELL TELEPHONE COMPANY' per SAM.gov hierarchy	2026-07-18
21b5ad17-3d56-1895-9497-59bc8f8d29f0-C	ARTIVION, INC	AORT	own-name	Recipient name 'ARTIVION, INC' matches SEC issuer 'ARTIVION, INC.' (AORT)	2026-07-18
223a51b1-d9aa-b2d3-7642-8295d9a47223-C	ADM RICE INC	ADM	parent-name	SAM.gov parent 'ARCHER-DANIELS-MIDLAND COMPANY' matches SEC issuer 'Archer-Daniels-Midland Co' (ADM); subsidiary 'ADM RICE INC' per SAM.gov hierarchy	2026-07-18
25bed424-595c-f091-acaa-5ccdea9eed59-C	VIRGINIA ELECTRIC AND POWER COMPANY	D	parent-name	SAM.gov parent 'DOMINION ENERGY, INC.' matches SEC issuer 'DOMINION ENERGY, INC' (D); subsidiary 'VIRGINIA ELECTRIC AND POWER COMPANY' per SAM.gov hierarchy	2026-07-18
26206021-3c95-80f8-8ebb-e44b98937974-C	SMITH & NEPHEW, INC.	SNN	own-name	Recipient name 'SMITH & NEPHEW, INC.' matches SEC issuer 'SMITH & NEPHEW PLC' (SNN)	2026-07-18
2697b8f8-115d-2ae1-bded-25a933bfd6ca-C	SMITH & NEPHEW INC	SNN	own-name	Recipient name 'SMITH & NEPHEW INC' matches SEC issuer 'SMITH & NEPHEW PLC' (SNN)	2026-07-18
26f00ae5-8cb8-d442-041f-5cc9072cd581-C	LUMASENSE TECHNOLOGIES, INC	AEIS	parent-name	SAM.gov parent 'ADVANCED ENERGY INDUSTRIES INC' matches SEC issuer 'ADVANCED ENERGY INDUSTRIES INC' (AEIS); subsidiary 'LUMASENSE TECHNOLOGIES, INC' per SAM.gov hierarchy	2026-07-18
27eda372-3f44-0c3c-7b78-b7f5dbefd2e8-C	CUSHMAN & WAKEFIELD INC	CWK	own-name	Recipient name 'CUSHMAN & WAKEFIELD INC' matches SEC issuer 'Cushman & Wakefield Ltd.' (CWK)	2026-07-18
28322da1-4ca5-b20b-1e6e-6c3da7ae8071-C	NATIONAL GRID USA SERVICE COMPANY, INC.	NGG	own-name	Recipient name 'NATIONAL GRID USA SERVICE COMPANY, INC.' matches SEC issuer 'NATIONAL GRID PLC' (NGG)	2026-07-18
2acfbd75-26c2-0328-d37e-27e90dcef4db-C	RAYTHEON/LOCKHEED MARTIN JAVELIN JV	RTX	parent-name	SAM.gov parent 'RTX CORP' matches SEC issuer 'RTX Corp' (RTX); subsidiary 'RAYTHEON/LOCKHEED MARTIN JAVELIN JV' per SAM.gov hierarchy	2026-07-18
2bcc84b1-fc6a-77a3-e418-10abe600fb5f-C	JOHNSON CONTROLS FIRE PROTECTION LP	JCI	parent-name	SAM.gov parent 'JOHNSON CONTROLS, INC.' matches SEC issuer 'Johnson Controls International plc' (JCI); subsidiary 'JOHNSON CONTROLS FIRE PROTECTION LP' per SAM.gov hierarchy	2026-07-18
2d0fb54c-8c59-b112-8ece-d0db6b5089eb-C	BRANTNER AND ASSOCIATES, INC.	TEL	parent-name	SAM.gov parent 'TE CONNECTIVITY LTD.' matches SEC issuer 'TE Connectivity plc' (TEL); subsidiary 'BRANTNER AND ASSOCIATES, INC.' per SAM.gov hierarchy	2026-07-18
2daab7a7-91da-74a6-ba82-682ef9da1fc7-C	ROCKWELL AUTOMATION, INC.	ROK	own-name	Recipient name 'ROCKWELL AUTOMATION, INC.' matches SEC issuer 'ROCKWELL AUTOMATION, INC' (ROK)	2026-07-18
2e28641b-d8b0-be2b-fb19-a5e8d3e334e6-C	PANJIVA, INC	SPGI	parent-name	SAM.gov parent 'S&P GLOBAL INC.' matches SEC issuer 'S&P Global Inc.' (SPGI); subsidiary 'PANJIVA, INC' per SAM.gov hierarchy	2026-07-18
2f611a25-9e07-9d3e-38fe-171ec7f2b2d4-C	OGILVY PUBLIC RELATIONS WORLDWIDE LLC	WPP	parent-name	SAM.gov parent 'WPP PLC' matches SEC issuer 'WPP plc' (WPP); subsidiary 'OGILVY PUBLIC RELATIONS WORLDWIDE LLC' per SAM.gov hierarchy	2026-07-18
30b32b62-ffbf-d7e6-5b9d-95a295b95a6d-C	BOOZ ALLEN HAMILTON INC	BAH	own-name	Recipient name 'BOOZ ALLEN HAMILTON INC' matches SEC issuer 'Booz Allen Hamilton Holding Corp' (BAH)	2026-07-18
314864f8-c8ed-733f-da40-569a09eaee81-C	REMEL INC.	TMO	parent-name	SAM.gov parent 'THERMO FISHER SCIENTIFIC INC.' matches SEC issuer 'THERMO FISHER SCIENTIFIC INC.' (TMO); subsidiary 'REMEL INC.' per SAM.gov hierarchy	2026-07-18
3241605e-a536-94ee-2b38-2c56bca7d9c0-C	AVIS RENT A CAR SYSTEM, LLC	CAR	parent-name	SAM.gov parent 'AVIS BUDGET GROUP, INC.' matches SEC issuer 'AVIS BUDGET GROUP, INC.' (CAR); subsidiary 'AVIS RENT A CAR SYSTEM, LLC' per SAM.gov hierarchy	2026-07-18
360760cb-a2ed-6aa4-2d81-a7909557d12c-C	HONEYWELL INTERNATIONAL INC.	HON	own-name	Recipient name 'HONEYWELL INTERNATIONAL INC.' matches SEC issuer 'HONEYWELL INTERNATIONAL INC' (HON)	2026-07-18
3612de0a-9635-3846-a5a1-7f555fba52df-C	DELL FEDERAL SYSTEMS L.P	DELL	parent-name	SAM.gov parent 'DELL TECHNOLOGIES INC.' matches SEC issuer 'Dell Technologies Inc.' (DELL); subsidiary 'DELL FEDERAL SYSTEMS L.P' per SAM.gov hierarchy	2026-07-18
379b0a4a-69bf-aa93-6907-c828ad4635a4-C	CANON FINANCIAL SERVICES, INC.	CAJPY	parent-name	SAM.gov parent 'CANON INC.' matches SEC issuer 'CANON INC' (CAJPY); subsidiary 'CANON FINANCIAL SERVICES, INC.' per SAM.gov hierarchy	2026-07-18
388ab88d-74c2-54ac-19e4-cb2df60ad520-C	TYSON FOODS INC.	TSN	own-name	Recipient name 'TYSON FOODS INC.' matches SEC issuer 'TYSON FOODS, INC.' (TSN)	2026-07-18
38edfb63-f368-e976-7fce-8f100a2f30b9-C	DOMINION PRIVATIZATION VIRGINIA, LLC	D	parent-name	SAM.gov parent 'DOMINION ENERGY, INC.' matches SEC issuer 'DOMINION ENERGY, INC' (D); subsidiary 'DOMINION PRIVATIZATION VIRGINIA, LLC' per SAM.gov hierarchy	2026-07-18
39120e4d-cc1c-07a1-ba75-0d0b10a47b97-C	BOOZ ALLEN HAMILTON INC	BAH	own-name	Recipient name 'BOOZ ALLEN HAMILTON INC' matches SEC issuer 'Booz Allen Hamilton Holding Corp' (BAH)	2026-07-18
39eabfb8-e859-05b4-9485-86c17286ba46-C	THERMO SCIENTIFIC PORTABLE ANALYTICAL INSTRUMENTS INC.	TMO	parent-name	SAM.gov parent 'THERMO FISHER SCIENTIFIC INC.' matches SEC issuer 'THERMO FISHER SCIENTIFIC INC.' (TMO); subsidiary 'THERMO SCIENTIFIC PORTABLE ANALYTICAL INSTRUMENTS INC.' per SAM.gov hierarchy	2026-07-18
3a3721f9-b023-7fd4-1d19-315f54efaafe-C	PROQUEST LLC	CLVT	parent-name	SAM.gov parent 'CLARIVATE PLC' matches SEC issuer 'CLARIVATE PLC' (CLVT); subsidiary 'PROQUEST LLC' per SAM.gov hierarchy	2026-07-18
3b507120-47bb-6581-7ec2-0dbbb96de860-C	UBER TECHNOLOGIES, INC.	UBER	own-name	Recipient name 'UBER TECHNOLOGIES, INC.' matches SEC issuer 'Uber Technologies, Inc' (UBER)	2026-07-18
3b9c0dbd-b9c4-b7d2-3441-01e53b2136d6-C	DELTA AIR LINES, INC.	DAL	own-name	Recipient name 'DELTA AIR LINES, INC.' matches SEC issuer 'DELTA AIR LINES, INC.' (DAL)	2026-07-18
3ce4c8f8-2cae-67b5-75db-644e5e88b54b-C	HOST HOTELS & RESORTS LP	HST	own-name	Recipient name 'HOST HOTELS & RESORTS LP' matches SEC issuer 'HOST HOTELS & RESORTS, INC.' (HST)	2026-07-18
3f1fc442-c908-93e2-51d0-a732086bd82c-C	CHSP TRS FISHERMAN WHARF LLC	PK	parent-name	SAM.gov parent 'PARK HOTELS & RESORTS INC.' matches SEC issuer 'Park Hotels & Resorts Inc.' (PK); subsidiary 'CHSP TRS FISHERMAN WHARF LLC' per SAM.gov hierarchy	2026-07-18
3f4b042f-341c-af1f-1f2f-e2f9d6d086b4-C	REAL CAPITAL ANALYTICS, INC	MSCI	parent-name	SAM.gov parent 'MSCI INC' matches SEC issuer 'MSCI Inc.' (MSCI); subsidiary 'REAL CAPITAL ANALYTICS, INC' per SAM.gov hierarchy	2026-07-18
4051d253-67f0-30bd-2c7f-5eb539533924-C	LOCKHEED MARTIN CORP	LMT	own-name	Recipient name 'LOCKHEED MARTIN CORP' matches SEC issuer 'LOCKHEED MARTIN CORP' (LMT)	2026-07-18
416e01b8-a579-75ca-d731-d28aca2e2d59-C	GULFSTREAM AEROSPACE CORPORATION	GD	parent-name	SAM.gov parent 'GENERAL DYNAMICS CORP' matches SEC issuer 'GENERAL DYNAMICS CORP' (GD); subsidiary 'GULFSTREAM AEROSPACE CORPORATION' per SAM.gov hierarchy	2026-07-18
42466698-fd45-b54a-8678-8f7fa4a4f88b-C	GOODRICH ACTUATION SYSTEMS LIMITED	RTX	parent-name	SAM.gov parent 'RTX CORP' matches SEC issuer 'RTX Corp' (RTX); subsidiary 'GOODRICH ACTUATION SYSTEMS LIMITED' per SAM.gov hierarchy	2026-07-18
43804642-bf8d-a303-906f-faeeb9fa7d8a-C	LEXISNEXIS RISK SOLUTIONS FL INC.	RELX	parent-name	SAM.gov parent 'RELX PLC' matches SEC issuer 'RELX PLC' (RELX); subsidiary 'LEXISNEXIS RISK SOLUTIONS FL INC.' per SAM.gov hierarchy	2026-07-18
4386ea28-0ac2-26d8-57cb-ccf3e78cd65e-C	PERFORMANCE EQUITY MANAGEMENT, LLC	GM	parent-name	SAM.gov parent 'GENERAL MOTORS COMPANY' matches SEC issuer 'General Motors Co' (GM); subsidiary 'PERFORMANCE EQUITY MANAGEMENT, LLC' per SAM.gov hierarchy	2026-07-18
447b8c8a-5d1b-fb75-ef60-846c227097c6-C	SBA TOWERS II LLC	SBAC	parent-name	SAM.gov parent 'SBA COMMUNICATIONS CORPORATION' matches SEC issuer 'SBA COMMUNICATIONS CORP' (SBAC); subsidiary 'SBA TOWERS II LLC' per SAM.gov hierarchy	2026-07-18
44ce81f7-2dd1-a89d-90d9-2d5b885e3f41-C	MENTOR WORLDWIDE LLC	JNJ	parent-name	SAM.gov parent 'JOHNSON & JOHNSON' matches SEC issuer 'JOHNSON & JOHNSON' (JNJ); subsidiary 'MENTOR WORLDWIDE LLC' per SAM.gov hierarchy	2026-07-18
4550c803-89d0-bce3-c617-b6add852480b-C	CUMMINS ROCKY MOUNTAIN, LLC	CMI	parent-name	SAM.gov parent 'CUMMINS INC.' matches SEC issuer 'CUMMINS INC' (CMI); subsidiary 'CUMMINS ROCKY MOUNTAIN, LLC' per SAM.gov hierarchy	2026-07-18
455555be-773d-eab1-1e6b-7b94400b757e-C	GENERAL DYNAMICS INFORMATION TECHNOLOGY, INC.	GD	parent-name	SAM.gov parent 'GENERAL DYNAMICS CORP' matches SEC issuer 'GENERAL DYNAMICS CORP' (GD); subsidiary 'GENERAL DYNAMICS INFORMATION TECHNOLOGY, INC.' per SAM.gov hierarchy	2026-07-18
46023044-eacc-a9ca-5b5e-ddc4673fc267-C	LOCKHEED MARTIN CORP	LMT	own-name	Recipient name 'LOCKHEED MARTIN CORP' matches SEC issuer 'LOCKHEED MARTIN CORP' (LMT)	2026-07-18
464a5b15-000e-8668-246a-c4067a6f0452-C	HAMILTON SUNDSTRAND CORPORATION	RTX	parent-name	SAM.gov parent 'RTX CORP' matches SEC issuer 'RTX Corp' (RTX); subsidiary 'HAMILTON SUNDSTRAND CORPORATION' per SAM.gov hierarchy	2026-07-18
49ba01f3-56b6-92fd-1814-1a521f21fe7e-C	LOCKHEED MARTIN CORPORATION	LMT	own-name	Recipient name 'LOCKHEED MARTIN CORPORATION' matches SEC issuer 'LOCKHEED MARTIN CORP' (LMT)	2026-07-18
4a1f028e-c2db-7515-800b-214ca781631c-C	ILLINOIS TOOL WORKS INC	ITW	own-name	Recipient name 'ILLINOIS TOOL WORKS INC' matches SEC issuer 'ILLINOIS TOOL WORKS INC' (ITW)	2026-07-18
4a228748-a256-002e-de46-4dd145e98dfe-C	RAYTHEON COMPANY	RTX	parent-name	SAM.gov parent 'RTX CORP' matches SEC issuer 'RTX Corp' (RTX); subsidiary 'RAYTHEON COMPANY' per SAM.gov hierarchy	2026-07-18
4acc00cb-4142-56db-919d-5873214336ee-C	AZENTA, INC.	AZTA	own-name	Recipient name 'AZENTA, INC.' matches SEC issuer 'Azenta, Inc.' (AZTA)	2026-07-18
4b338935-1fe1-e136-3ef3-dbe01c516fbd-C	DERCO AEROSPACE, INC.	RTX	parent-name	SAM.gov parent 'RTX CORP' matches SEC issuer 'RTX Corp' (RTX); subsidiary 'DERCO AEROSPACE, INC.' per SAM.gov hierarchy	2026-07-18
4b777065-0adb-34ac-c8e1-f0d179d81b63-C	BIO-RAD LABORATORIES, INC.	BIO	own-name	Recipient name 'BIO-RAD LABORATORIES, INC.' matches SEC issuer 'BIO-RAD LABORATORIES, INC.' (BIO)	2026-07-18
4b893934-0e74-c4ac-f525-6a2beb1f7b32-C	ABBOTT LABORATORIES INC.	ABT	own-name	Recipient name 'ABBOTT LABORATORIES INC.' matches SEC issuer 'ABBOTT LABORATORIES' (ABT)	2026-07-18
4bd73aa7-7f60-a3d9-4397-54df40f279f6-C	INSPIRE MEDICAL SYSTEMS, INC.	INSP	own-name	Recipient name 'INSPIRE MEDICAL SYSTEMS, INC.' matches SEC issuer 'Inspire Medical Systems, Inc.' (INSP)	2026-07-18
4c3d8bed-0309-8dd4-8279-e0fa623505f2-C	VECTREN ENERGY DELIVERY OF OHIO, LLC	CNP	parent-name	SAM.gov parent 'CENTERPOINT ENERGY, INC.' matches SEC issuer 'CENTERPOINT ENERGY INC' (CNP); subsidiary 'VECTREN ENERGY DELIVERY OF OHIO, LLC' per SAM.gov hierarchy	2026-07-18
4cae6b4e-1ccc-101c-c2bc-368bcd4e5340-C	RAYTHEON COMPANY	RTX	parent-name	SAM.gov parent 'RTX CORP' matches SEC issuer 'RTX Corp' (RTX); subsidiary 'RAYTHEON COMPANY' per SAM.gov hierarchy	2026-07-18
4d954735-5a17-9d2f-f9ad-bd508ab2d168-C	FISHER SCIENTIFIC COMPANY L.L.C.	TMO	parent-name	SAM.gov parent 'THERMO FISHER SCIENTIFIC INC.' matches SEC issuer 'THERMO FISHER SCIENTIFIC INC.' (TMO); subsidiary 'FISHER SCIENTIFIC COMPANY L.L.C.' per SAM.gov hierarchy	2026-07-18
4dc93a45-67c0-81d9-c200-dc69b5cdcf76-C	WASTE MANAGEMENT OF MINNESOTA, INC.	WM	parent-name	SAM.gov parent 'WASTE MANAGEMENT, INC.' matches SEC issuer 'WASTE MANAGEMENT INC' (WM); subsidiary 'WASTE MANAGEMENT OF MINNESOTA, INC.' per SAM.gov hierarchy	2026-07-18
4e27a227-9e6f-eae8-b53b-d4f80d11cfef-C	INTERNATIONAL BUSINESS MACHINES CORPORATION	IBM	own-name	Recipient name 'INTERNATIONAL BUSINESS MACHINES CORPORATION' matches SEC issuer 'INTERNATIONAL BUSINESS MACHINES CORP' (IBM)	2026-07-18
4ebe5797-a7aa-41d5-c055-4fb073a3804e-C	LOCKHEED MARTIN SERVICES, LLC	LMT	own-name	Recipient name 'LOCKHEED MARTIN SERVICES, LLC' matches SEC issuer 'LOCKHEED MARTIN CORP' (LMT)	2026-07-18
4f309755-a9a2-cb5a-a1e4-6b613f056590-C	UNITED RENTALS (NORTH AMERICA), INC.	URI	own-name	Recipient name 'UNITED RENTALS (NORTH AMERICA), INC.' matches SEC issuer 'UNITED RENTALS, INC.' (URI)	2026-07-18
5068bf75-a8a3-af40-b3a0-ba93566e89e1-C	JOHNSON CONTROLS SECURITY SOLUTIONS LLC	JCI	parent-name	SAM.gov parent 'JOHNSON CONTROLS, INC.' matches SEC issuer 'Johnson Controls International plc' (JCI); subsidiary 'JOHNSON CONTROLS SECURITY SOLUTIONS LLC' per SAM.gov hierarchy	2026-07-18
5099e6a7-7a4e-921b-9375-d64b9383d38e-C	OTIS ELEVATOR COMPANY	RTX	parent-name	SAM.gov parent 'RTX CORP' matches SEC issuer 'RTX Corp' (RTX); subsidiary 'OTIS ELEVATOR COMPANY' per SAM.gov hierarchy	2026-07-18
512f160b-e5b9-7039-89f7-9b78c6367ee9-C	KNOLL, INC.	MLKN	parent-name	SAM.gov parent 'MILLERKNOLL INC' matches SEC issuer 'MILLERKNOLL, INC.' (MLKN); subsidiary 'KNOLL, INC.' per SAM.gov hierarchy	2026-07-18
5139d3f2-159b-be39-2cfa-5b5eb8b17caf-C	JOHNSON CONTROLS FIRE PROTECTION LP	JCI	parent-name	SAM.gov parent 'JOHNSON CONTROLS, INC.' matches SEC issuer 'Johnson Controls International plc' (JCI); subsidiary 'JOHNSON CONTROLS FIRE PROTECTION LP' per SAM.gov hierarchy	2026-07-18
51bc164d-0975-136d-3fb5-d67ade0957a7-C	RAYTHEON COMPANY	RTX	parent-name	SAM.gov parent 'RTX CORP' matches SEC issuer 'RTX Corp' (RTX); subsidiary 'RAYTHEON COMPANY' per SAM.gov hierarchy	2026-07-18
51bcdd60-3b39-c1e0-eb40-86dc589989c5-C	CUMMINS INC	CMI	own-name	Recipient name 'CUMMINS INC' matches SEC issuer 'CUMMINS INC' (CMI)	2026-07-18
52a30156-c031-3fed-cf47-acdeb13d29dd-C	BOSTON SCIENTIFIC NEUROMODULATION CORP	BSX	parent-name	SAM.gov parent 'BOSTON SCIENTIFIC CORP' matches SEC issuer 'BOSTON SCIENTIFIC CORP' (BSX); subsidiary 'BOSTON SCIENTIFIC NEUROMODULATION CORP' per SAM.gov hierarchy	2026-07-18
53ffa4ca-993b-c29c-d8d4-e8e916d4176b-C	MARRIOTT INTERNATIONAL INC	RHP	parent-name	SAM.gov parent 'RYMAN HOSPITALITY PROPERTIES, INC.' matches SEC issuer 'Ryman Hospitality Properties, Inc.' (RHP); subsidiary 'MARRIOTT INTERNATIONAL INC' per SAM.gov hierarchy	2026-07-18
5487725e-5e9d-21a3-1fbd-6b8aa9244a20-C	ROLLER BEARING COMPANY OF AMERICA, INC.	RBC	parent-name	SAM.gov parent 'RBC BEARINGS INCORPORATED' matches SEC issuer 'RBC Bearings INC' (RBC); subsidiary 'ROLLER BEARING COMPANY OF AMERICA, INC.' per SAM.gov hierarchy	2026-07-18
5611c685-611f-82c0-fd9a-1f336e1d40a4-C	KFT FIRE TRAINER LLC	RTX	parent-name	SAM.gov parent 'RTX CORP' matches SEC issuer 'RTX Corp' (RTX); subsidiary 'KFT FIRE TRAINER LLC' per SAM.gov hierarchy	2026-07-18
